{
  "kind": "guild.admission_request",
  "version": "1.0.0",
  "request_id": "urn:guild:request:runtime-log-write:admit:v1",
  "contract": {
    "contract_id": "urn:guild:contract:runtime-log-write:v1",
    "component_digest": {
      "algorithm": "sha256",
      "value": "9878310506fa7fc567cdb991b838e82b5e5848a2eec6ad8a8012b78f34290f53"
    }
  },
  "input_class_fingerprint": {
    "kind": "json-schema-hash",
    "canonicalization": "rfc8785-jcs",
    "digest": {
      "algorithm": "sha256",
      "value": "f280d6a15c5f96b6d50a34ec5a4d8dd9d2b4bd7f2ccf7c0ce4a14352b57375c7"
    }
  },
  "runtime_candidates": [
    {
      "runtime_guarantee_id": "urn:guild:runtime:wasmtime-strict:v1"
    }
  ],
  "preferred_runtime_guarantee_id": "urn:guild:runtime:wasmtime-strict:v1",
  "requested_authority": {
    "grants": [
      {
        "family": "log-write",
        "scope": {
          "kind": "log",
          "levels": [
            "info"
          ]
        },
        "cardinality": {
          "max_calls": 1
        }
      }
    ],
    "ttl_seconds": 120
  },
  "requested_witness_level": "hostcall",
  "audience_binding_inputs": [],
  "resource_binding_inputs": [],
  "delegation_chain_input": {
    "caller_chain": [
      "urn:guild:actor:runtime-alignment-test"
    ],
    "requested_max_hops": 0
  },
  "invocation_constraints": {
    "valid_for_seconds": 120
  }
}
